{
    "objects": {
        "constraints": null,
        "fix_objects": [],
        "scene_objects": [
            {
                "sample": {
                    "min_num": 0,
                    "max_num": 2,
                    "max_repeat": 1
                },
                "workspace_id": "work_table",
                "sub_workspace": {
                    "x": {
                        "min": 0.0,
                        "max": 0.8
                    },
                    "y": {
                        "min": 0.0,
                        "max": 1.0
                    }
                },
                "available_objects": [
                    {
                        "data_info_dir": "objects/benchmark/building_blocks/benchmark_building_blocks_073/",
                        "object_id": "geniesim_2025_building_blocks_medium_073",
                        "mass": 0.05
                    },
                    {
                        "data_info_dir": "objects/benchmark/building_blocks/benchmark_building_blocks_077/",
                        "object_id": "geniesim_2025_building_blocks_medium_077",
                        "mass": 0.05
                    },
                    {
                        "data_info_dir": "objects/benchmark/building_blocks/benchmark_building_blocks_081/",
                        "object_id": "geniesim_2025_building_blocks_medium_081",
                        "mass": 0.05
                    },
                    {
                        "data_info_dir": "objects/benchmark/building_blocks/benchmark_building_blocks_085/",
                        "object_id": "geniesim_2025_building_blocks_medium_085",
                        "mass": 0.05
                    },
                    {
                        "data_info_dir": "objects/benchmark/building_blocks/benchmark_building_blocks_089/",
                        "object_id": "geniesim_2025_building_blocks_medium_089",
                        "mass": 0.05
                    }
                ]
            }
        ],
        "task_related_objects": [
            {
                "candidate_objects": [
                    {
                        "data_info_dir": "objects/benchmark/building_blocks/benchmark_building_blocks_074/",
                        "object_id": "geniesim_2025_building_blocks_large_074",
                        "mass": 0.05
                    },
                    {
                        "data_info_dir": "objects/benchmark/building_blocks/benchmark_building_blocks_078/",
                        "object_id": "geniesim_2025_building_blocks_large_078",
                        "mass": 0.05
                    },
                    {
                        "data_info_dir": "objects/benchmark/building_blocks/benchmark_building_blocks_082/",
                        "object_id": "geniesim_2025_building_blocks_large_082",
                        "mass": 0.05
                    },
                    {
                        "data_info_dir": "objects/benchmark/building_blocks/benchmark_building_blocks_086/",
                        "object_id": "geniesim_2025_building_blocks_large_086",
                        "mass": 0.05
                    },
                    {
                        "data_info_dir": "objects/benchmark/building_blocks/benchmark_building_blocks_090/",
                        "object_id": "geniesim_2025_building_blocks_large_090",
                        "mass": 0.05
                    }
                ],
                "object_id": "geniesim_2025_building_blocks_biggest",
                "workspace_id": "work_table",
                "sub_workspace": {
                    "x": {
                        "min": 0.0,
                        "max": 0.8
                    },
                    "y": {
                        "min": 0.0,
                        "max": 1.0
                    }
                },
                "mass": 0.05
            },
            {
                "candidate_objects": [
                    {
                        "data_info_dir": "objects/benchmark/building_blocks/benchmark_building_blocks_072/",
                        "object_id": "geniesim_2025_building_blocks_smallest_072",
                        "mass": 0.05
                    },
                    {
                        "data_info_dir": "objects/benchmark/building_blocks/benchmark_building_blocks_076/",
                        "object_id": "geniesim_2025_building_blocks_smallest_076",
                        "mass": 0.05
                    },
                    {
                        "data_info_dir": "objects/benchmark/building_blocks/benchmark_building_blocks_080/",
                        "object_id": "geniesim_2025_building_blocks_smallest_080",
                        "mass": 0.05
                    },
                    {
                        "data_info_dir": "objects/benchmark/building_blocks/benchmark_building_blocks_084/",
                        "object_id": "geniesim_2025_building_blocks_smallest_084",
                        "mass": 0.05
                    },
                    {
                        "data_info_dir": "objects/benchmark/building_blocks/benchmark_building_blocks_088/",
                        "object_id": "geniesim_2025_building_blocks_smallest_088",
                        "mass": 0.05
                    }
                ],
                "object_id": "geniesim_2025_building_blocks_smallest",
                "workspace_id": "work_table",
                "sub_workspace": {
                    "x": {
                        "min": 0.0,
                        "max": 0.8
                    },
                    "y": {
                        "min": 0.0,
                        "max": 1.0
                    }
                },
                "mass": 0.05
            }
        ]
    },
    "recording_setting": {
        "camera_list": [
            "/G2/head_link3/head_front_Camera",
            "/G2/gripper_r_base_link/Right_Camera",
            "/G2/gripper_l_base_link/Left_Camera"
        ],
        "fps": 30,
        "num_of_episode": 3,
        "noised_probability": 0.0,
        "num_of_success": 1
    },
    "generalization": {
        "in_domain": {
            "lights": {
                "intensity_ratio": 0.15,
                "temperature_ratio": 0.1
            },
            "camera": {
                "x": 0.0,
                "y": 0.0,
                "z": 0.0,
                "roll": 2.0,
                "pitch": 2.0,
                "yaw": 2.0
            }
        },
        "ood": {
            "light": {
                "lights": {
                    "intensity": [
                        6000,
                        8000,
                        12000,
                        16000,
                        20000
                    ],
                    "temperature": [
                        2500,
                        3000,
                        6000,
                        9000,
                        11000
                    ]
                }
            },
            "camera_pose": {
                "camera": {
                    "x": 0.0,
                    "y": 0.0,
                    "z": 0.0,
                    "roll": 15.0,
                    "pitch": 15.0,
                    "yaw": 15.0
                }
            },
            "robot_initial_pose": {
                "init_base": {
                    "delta_position": [
                        0.15,
                        0.15,
                        0
                    ]
                },
                "init_joint": {
                    "thresh": 0.15
                }
            },
            "object_position": {
                "sub_workspace": {
                    "x": {
                        "min": 0.0,
                        "max": 1.0
                    },
                    "y": {
                        "min": 0.0,
                        "max": 1.0
                    }
                },
                "range_scale": 2.0
            },
            "unseen_object": {
                "candidate_objects": {}
            }
        }
    },
    "robot": {
        "arm": "dual",
        "init_arm_pose_noise": {
            ".*_arm_.*": {
                "noise_type": "uniform",
                "low": -0.05,
                "high": 0.05
            }
        },
        "init_arm_pose": {
            "idx21_arm_l_joint1": 0.739033,
            "idx61_arm_r_joint1": -0.739033,
            "idx05_body_joint5": 0.0,
            "idx11_head_joint1": 0.0,
            "idx22_arm_l_joint2": -0.717023,
            "idx62_arm_r_joint2": -0.717023,
            "idx04_body_joint4": 0.0,
            "idx12_head_joint2": 0.0,
            "idx23_arm_l_joint3": -1.524419,
            "idx63_arm_r_joint3": 1.524419,
            "idx03_body_joint3": 0.10025,
            "idx13_head_joint3": 0.11464,
            "idx24_arm_l_joint4": -1.537612,
            "idx64_arm_r_joint4": -1.537612,
            "idx02_body_joint2": 1.2172,
            "idx25_arm_l_joint5": 0.27811,
            "idx65_arm_r_joint5": -0.27811,
            "idx01_body_joint1": -0.83423,
            "idx26_arm_l_joint6": -0.925845,
            "idx66_arm_r_joint6": -0.925845,
            "idx27_arm_l_joint7": -0.839257,
            "idx67_arm_r_joint7": 0.839257,
            "idx111_chassis_lwheel_front_joint1": null,
            "idx121_chassis_lwheel_rear_joint1": null,
            "idx131_chassis_rwheel_front_joint1": null,
            "idx141_chassis_rwheel_rear_joint1": null,
            "idx112_chassis_lwheel_front_joint2": null,
            "idx122_chassis_lwheel_rear_joint2": null,
            "idx132_chassis_rwheel_front_joint2": null,
            "idx142_chassis_rwheel_rear_joint2": null,
            "idx31_gripper_l_inner_joint1": null,
            "idx41_gripper_l_outer_joint1": 0.85,
            "idx71_gripper_r_inner_joint1": null,